<?xml version="1.0" encoding="ISO-8859-1" ?>
<!DOCTYPE wire_profile_set SYSTEM "cdnwb.dtd">
<wire_profile_set>
  <wire_profile_vendor>
    <profile_vendor_name>Kulicke and Soffa</profile_vendor_name>
    <profile_vendor_logo_file>wbProfileKNSLogo.bmp</profile_vendor_logo_file>
  </wire_profile_vendor>
  <wire_profile_def>
    <profile_name>SL_LH3</profile_name>
    <profile_from_vendor>TRUE</profile_from_vendor>
    <profile_direction>FORWARD</profile_direction>
    <profile_diameter>1 MIL</profile_diameter>
    <profile_material>GOLD</profile_material>
    <profile_color>0</profile_color>
    <profile_visibility>TRUE</profile_visibility>
    <profile_point>
      <horizontal_type>Length</horizontal_type>
      <horizontal_value>0 MIL</horizontal_value>
      <vertical_type>Length</vertical_type>
      <vertical_value>0.5 MIL</vertical_value>
      </profile_point>
    <profile_point>
      <horizontal_type>Length</horizontal_type>
      <horizontal_value>0 MIL</horizontal_value>
      <vertical_type>Length</vertical_type>
      <vertical_value>2.5 MIL</vertical_value>
      </profile_point>
    </wire_profile_def>
  <wire_profile_def>
    <profile_name>SL_LH4</profile_name>
    <profile_from_vendor>TRUE</profile_from_vendor>
    <profile_direction>FORWARD</profile_direction>
    <profile_diameter>1 MIL</profile_diameter>
    <profile_material>GOLD</profile_material>
    <profile_color>0</profile_color>
    <profile_visibility>TRUE</profile_visibility>
    <profile_point>
      <horizontal_type>Length</horizontal_type>
      <horizontal_value>0 MIL</horizontal_value>
      <vertical_type>Length</vertical_type>
      <vertical_value>0.5 MIL</vertical_value>
      </profile_point>
    <profile_point>
      <horizontal_type>Length</horizontal_type>
      <horizontal_value>0 MIL</horizontal_value>
      <vertical_type>Length</vertical_type>
      <vertical_value>3.5 MIL</vertical_value>
      </profile_point>
    </wire_profile_def>
  <wire_profile_def>
    <profile_name>SL_LH5</profile_name>
    <profile_from_vendor>TRUE</profile_from_vendor>
    <profile_direction>FORWARD</profile_direction>
    <profile_diameter>1 MIL</profile_diameter>
    <profile_material>GOLD</profile_material>
    <profile_color>0</profile_color>
    <profile_visibility>TRUE</profile_visibility>
    <profile_point>
      <horizontal_type>Length</horizontal_type>
      <horizontal_value>0 MIL</horizontal_value>
      <vertical_type>Length</vertical_type>
      <vertical_value>0.5 MIL</vertical_value>
      </profile_point>
    <profile_point>
      <horizontal_type>Length</horizontal_type>
      <horizontal_value>4.5 MIL</horizontal_value>
      <vertical_type>Length</vertical_type>
      <vertical_value>4.5 MIL</vertical_value>
      </profile_point>
    </wire_profile_def>
  <wire_profile_def>
    <profile_name>SL_LH6</profile_name>
    <profile_from_vendor>TRUE</profile_from_vendor>
    <profile_direction>FORWARD</profile_direction>
    <profile_diameter>1 MIL</profile_diameter>
    <profile_material>GOLD</profile_material>
    <profile_color>0</profile_color>
    <profile_visibility>TRUE</profile_visibility>
    <profile_point>
      <horizontal_type>Length</horizontal_type>
      <horizontal_value>0 MIL</horizontal_value>
      <vertical_type>Length</vertical_type>
      <vertical_value>0.5 MIL</vertical_value>
      </profile_point>
    <profile_point>
      <horizontal_type>Length</horizontal_type>
      <horizontal_value>5.5 MIL</horizontal_value>
      <vertical_type>Length</vertical_type>
      <vertical_value>5.5 MIL</vertical_value>
      </profile_point>
    </wire_profile_def>
  <wire_profile_def>
    <profile_name>SL_LH7</profile_name>
    <profile_from_vendor>TRUE</profile_from_vendor>
    <profile_direction>FORWARD</profile_direction>
    <profile_diameter>1 MIL</profile_diameter>
    <profile_material>GOLD</profile_material>
    <profile_color>0</profile_color>
    <profile_visibility>TRUE</profile_visibility>
    <profile_point>
      <horizontal_type>Length</horizontal_type>
      <horizontal_value>0 MIL</horizontal_value>
      <vertical_type>Length</vertical_type>
      <vertical_value>0.5 MIL</vertical_value>
      </profile_point>
    <profile_point>
      <horizontal_type>Length</horizontal_type>
      <horizontal_value>6.5 MIL</horizontal_value>
      <vertical_type>Length</vertical_type>
      <vertical_value>6.5 MIL</vertical_value>
      </profile_point>
    </wire_profile_def>
  <wire_profile_def>
    <profile_name>SL_LH8</profile_name>
    <profile_from_vendor>TRUE</profile_from_vendor>
    <profile_direction>FORWARD</profile_direction>
    <profile_diameter>1 MIL</profile_diameter>
    <profile_material>GOLD</profile_material>
    <profile_color>0</profile_color>
    <profile_visibility>TRUE</profile_visibility>
    <profile_point>
      <horizontal_type>Length</horizontal_type>
      <horizontal_value>0 MIL</horizontal_value>
      <vertical_type>Length</vertical_type>
      <vertical_value>0.5 MIL</vertical_value>
      </profile_point>
    <profile_point>
      <horizontal_type>Length</horizontal_type>
      <horizontal_value>4.33 MIL</horizontal_value>
      <vertical_type>Length</vertical_type>
      <vertical_value>7.5 MIL</vertical_value>
      </profile_point>
    </wire_profile_def>
  <wire_profile_def>
    <profile_name>SL_LH9</profile_name>
    <profile_from_vendor>TRUE</profile_from_vendor>
    <profile_direction>FORWARD</profile_direction>
    <profile_diameter>1 MIL</profile_diameter>
    <profile_material>GOLD</profile_material>
    <profile_color>0</profile_color>
    <profile_visibility>TRUE</profile_visibility>
    <profile_point>
      <horizontal_type>Length</horizontal_type>
      <horizontal_value>0 MIL</horizontal_value>
      <vertical_type>Length</vertical_type>
      <vertical_value>0.5 MIL</vertical_value>
      </profile_point>
    <profile_point>
      <horizontal_type>Length</horizontal_type>
      <horizontal_value>4.91 MIL</horizontal_value>
      <vertical_type>Length</vertical_type>
      <vertical_value>8.5 MIL</vertical_value>
      </profile_point>
    </wire_profile_def>
  <wire_profile_def>
    <profile_name>SL_LH10</profile_name>
    <profile_from_vendor>TRUE</profile_from_vendor>
    <profile_direction>FORWARD</profile_direction>
    <profile_diameter>1 MIL</profile_diameter>
    <profile_material>GOLD</profile_material>
    <profile_color>0</profile_color>
    <profile_visibility>TRUE</profile_visibility>
    <profile_point>
      <horizontal_type>Length</horizontal_type>
      <horizontal_value>0 MIL</horizontal_value>
      <vertical_type>Length</vertical_type>
      <vertical_value>0.5 MIL</vertical_value>
      </profile_point>
    <profile_point>
      <horizontal_type>Length</horizontal_type>
      <horizontal_value>5.48 MIL</horizontal_value>
      <vertical_type>Length</vertical_type>
      <vertical_value>9.5 MIL</vertical_value>
      </profile_point>
    </wire_profile_def>
  <wire_profile_def>
    <profile_name>SL_LH11</profile_name>
    <profile_from_vendor>TRUE</profile_from_vendor>
    <profile_direction>FORWARD</profile_direction>
    <profile_diameter>1 MIL</profile_diameter>
    <profile_material>GOLD</profile_material>
    <profile_color>0</profile_color>
    <profile_visibility>TRUE</profile_visibility>
    <profile_point>
      <horizontal_type>Length</horizontal_type>
      <horizontal_value>0 MIL</horizontal_value>
      <vertical_type>Length</vertical_type>
      <vertical_value>0.5 MIL</vertical_value>
      </profile_point>
    <profile_point>
      <horizontal_type>Length</horizontal_type>
      <horizontal_value>2.81 MIL</horizontal_value>
      <vertical_type>Length</vertical_type>
      <vertical_value>10.5 MIL</vertical_value>
      </profile_point>
    </wire_profile_def>
  <wire_profile_def>
    <profile_name>SL_LH12</profile_name>
    <profile_from_vendor>TRUE</profile_from_vendor>
    <profile_direction>FORWARD</profile_direction>
    <profile_diameter>1 MIL</profile_diameter>
    <profile_material>GOLD</profile_material>
    <profile_color>0</profile_color>
    <profile_visibility>TRUE</profile_visibility>
    <profile_point>
      <horizontal_type>Length</horizontal_type>
      <horizontal_value>0 MIL</horizontal_value>
      <vertical_type>Length</vertical_type>
      <vertical_value>0.5 MIL</vertical_value>
      </profile_point>
    <profile_point>
      <horizontal_type>Length</horizontal_type>
      <horizontal_value>3.08 MIL</horizontal_value>
      <vertical_type>Length</vertical_type>
      <vertical_value>11.5 MIL</vertical_value>
      </profile_point>
    </wire_profile_def>
  <wire_profile_def>
    <profile_name>SL_LH13</profile_name>
    <profile_from_vendor>TRUE</profile_from_vendor>
    <profile_direction>FORWARD</profile_direction>
    <profile_diameter>1 MIL</profile_diameter>
    <profile_material>GOLD</profile_material>
    <profile_color>0</profile_color>
    <profile_visibility>TRUE</profile_visibility>
    <profile_point>
      <horizontal_type>Length</horizontal_type>
      <horizontal_value>0 MIL</horizontal_value>
      <vertical_type>Length</vertical_type>
      <vertical_value>0.5 MIL</vertical_value>
      </profile_point>
    <profile_point>
      <horizontal_type>Length</horizontal_type>
      <horizontal_value>3.35 MIL</horizontal_value>
      <vertical_type>Length</vertical_type>
      <vertical_value>12.5 MIL</vertical_value>
      </profile_point>
    </wire_profile_def>
  <wire_profile_def>
    <profile_name>SL_LH14</profile_name>
    <profile_from_vendor>TRUE</profile_from_vendor>
    <profile_direction>FORWARD</profile_direction>
    <profile_diameter>1 MIL</profile_diameter>
    <profile_material>GOLD</profile_material>
    <profile_color>0</profile_color>
    <profile_visibility>TRUE</profile_visibility>
    <profile_point>
      <horizontal_type>Length</horizontal_type>
      <horizontal_value>0 MIL</horizontal_value>
      <vertical_type>Length</vertical_type>